{
  "task_id": "tsk_01",
  "status": "partial",
  "basis": "commercial screen, price incl. warranty",
  "ranking": [
    { "place_id": "ChIJexample01", "rank": 1, "reason": "cheapest commercial screen: 450 SAR with a 30-day warranty" },
    { "place_id": "ChIJexample03", "rank": 2, "reason": "commercial screen: 520 SAR with a 14-day warranty" }
  ],
  "excluded": [
    { "place_id": "ChIJexample02", "reason": "no answer after one retry" }
  ],
  "cannot_compare_reasons": []
}
